"l'avis le plus positif","l'avis le plus négatif","https://www.trustedshops.fr/evaluation/info_XA3F5BBDE34B5AD3FB64015EB823AC7C6.html","","","","","","","","","","Avis pour laredoute.fr","","Pour vérifier l’authenticité","","Avis validés","","","","","","","","","","","Notre mission est de favoriser la confiance digital. Plus d’info","comment fonctionnent les avis","chez Trusted Shops.","Client de laredoute.fr","Signaler un avis","26 nov. 2022","Avis validé","Satisfaite de ma commande. Par contre très en colère et me sens flouée par le cadeau à 0 €, en cliquant vous avez le droit à une trottinette, un plein d'essence et autre chose en payant 1€ On vous dirige vers Tech VIP  sur la page d'accueil un n° de passe et sur le site de trottinette mais plein d'autres produits. donc pas de commande de ma part. Un peu naïve cliente car n'ai pas lu jusqu'en bas de la page qui spécifiait qu'au bout de 48h je devenais adhérente et que je devais payer 29,20 (somme qui m'a été débitée) et ce tous les mois pour pouvoir acheter leur produit. Heureusement j'ai pu joindre TECH VIP qui a annulé mon adhésion. Votre kdo à 0€ m'a coûté 29,90 €. Je prends cela pour du vol qualifié et une anarque. je réfléchirai pour une prochaine commande à la redoute. Cordialement Danielle DEXIDIEUX","Lire la suite","Utile","1","+1","https://www.trustedshops.fr/evaluation/info_XA3F5BBDE34B5AD3FB64015EB823AC7C6.html?stars=4&stars=5","Voir les avis positifs","23 oct. 2022","Nous avons acheté une ménagère dans un magasin et fait livré en point relai (relai colis).
Le colis devait arriver 3 jours plus tard (un mardi) ce qui nous allait bien car nous en avions besoin pour recevoir nos invités (le samedi qui suit).
Au final, le colis s’est perdu en chemin. Ni la redoute ni relai colis était capable de nous dire où il se trouvait, bien que le colis était marqué comme livré au point relai. 
Nous nous sommes déplacé dans 3 points relais différents car nous avions reçu 3 notifications. 
Le colis n’était pas présent à chaque fois. 
Un interlocuteur de chez relai colis lance une enquête pour déterminer où se trouve le colis et nous assure le traiter de toute urgence. On espérait vraiment l’avoir pour samedi…
Nous l’avons reçu finalement 7 jours plus tard après le mardi supposé livré. 
0 intérêt pour nous dans ce cas là… la ménagère est encore dans son carton tellement nous avons été déçu du temps de livraison…","3","https://www.trustedshops.fr/evaluation/info_XA3F5BBDE34B5AD3FB64015EB823AC7C6.html?stars=1&stars=2&stars=3","Voir les avis négatifs","Recherche par mot-clé","Filtre","Avis","https://www.trustedshops.fr/evaluation/info_XA3F5BBDE34B5AD3FB64015EB823AC7C6.html?stars=5","(25 359)","https://www.trustedshops.fr/evaluation/info_XA3F5BBDE34B5AD3FB64015EB823AC7C6.html?stars=4","(6 033)","https://www.trustedshops.fr/evaluation/info_XA3F5BBDE34B5AD3FB64015EB823AC7C6.html?stars=3","(1 721)","https://www.trustedshops.fr/evaluation/info_XA3F5BBDE34B5AD3FB64015EB823AC7C6.html?stars=2","(1 030)","https://www.trustedshops.fr/evaluation/info_XA3F5BBDE34B5AD3FB64015EB823AC7C6.html?stars=1","(1 103)","Tri","Pertinence","https://www.trustedshops.fr/evaluation/info_XA3F5BBDE34B5AD3FB64015EB823AC7C6.html","https://www.trustedshops.fr/evaluation/info_XA3F5BBDE34B5AD3FB64015EB823AC7C6.html?sort=date","Le plus récent d'abord","6 oct. 2023","Bonjour 
J'ai été très heureuse par la rapidité de l'envoi , mon achat correspond totalement à la description faite sur le site.
Merci à vous","Afficher plus","1 oct. 2023","Achat de draps","La livraison a été extrèmement rapide. Les articles commandés sont conformes au descriptif, pas de surprise. Conforme à ce que j'en attendais.","1 oct. 2023","Jolis coussins.","Rapidité de la commande
Par contre l un des articles commandé n était pas celui que j ai reçu : erreur d étiquetage,  je viens de le retourner","30 sept. 2023","Service professionnel et sérieux dans la livraison. 

Le reste de l ""expérience "" client sera déterminée par la qualité des produits vendus.","25 sept. 2023","Sérieux et professionnel.","Les promotions régulières, la diversité et la qualité des produits, les livraisons rapides, les différentes options de paiement. Tout y est !!","29 sept. 2023","livrée en relais colis proche de mon domicile, produits de qualité, emballage impeccable, livraison en 48 heures. Parfait. Merci La Redoute.","28 sept. 2023","Ravie !","Je pense que la collection Anne weybrun est un peu trop cher, ça serait bien de faire des efforts de ce côté là merci de votre compréhension","25 sept. 2023","j'ai réalisé plusieurs achats ces derniers mois pour aménagement : déco, mobilier etc.
tout a été livré sans problème avec état irréprochable","JC","https://www.trustedshops.com/user/de_DE/f0fac023aec2c350f249e8036ba2452b","Jeanne","C.","Nancy","24 sept. 2023","Service de qualite","Livraison rapide ,produit de bonne qualité 
Cependant,avec la carte r prenium j avais droit a des remises supplémentaires c est bien dommage","AM","https://www.trustedshops.com/user/de_DE/edbb7663791a3f34f3244e7160cd4930","ann","m.","saint benoit reunion","il y a 4 jours","J’ai reçu les articles le lendemain de…","recherche et produits
Suite à ma recherche sur internet j'ai eu plusieurs choix, dont La Redoute, et du coup j'ai trouvé ce que je cherchais","il y a 9 jours","Beaucoup de choix ,facilité de commande ,délai et condition de livraison toujours correcte 
Je suis rarement dessus des choix de mes achats","il y a 12 jours","AVIS","Je viens de racheter des doubles rideaux pour completer un achat précédent. 
Commande rapide
Livraison rapide
Résultat top 
Je recommande !!","26 sept. 2023","Je suis très satisfaite de ma commande.
J’ai reçu les articles le lendemain de ma commande. Livraison très rapide et prix très intéressants.","BD","https://www.trustedshops.com/user/de_DE/c0468d44b282712a497cbe67df3421c0","Babou","D.","Poisat","22 sept. 2023","Voiles polyester effet lin très réussi 
Très beaux pour un prix correct 
Par contre plutôt un effet tamisant que voilage donc un peu opaque","il y a 3 jours","Livraison sans accroche, les assiettes sont arrivées très bien emballées et intactes.
Elles sont superbes !! Je ne regrette pas mon achat !","il y a 13 jours","Produits de qualité, livraison rapide, bonne information sur la livraison, colis bien emballés, site fiable, je suis cliente très contente.","8 oct. 2023","Des offres et promotions bien souvent 
Respect des livraisons qui sont rapides 
14 jours sont à mon sens trop long pour les remboursements","Client de laredoute.fr","7 oct. 2023","Bien mais...","Très satisfaite
Belle robe : la marque Anne Weyburn est une valeur sûre. Et service efficace : j'ai été livrée en deux jours c'est parfait","Client de laredoute.fr","25 sept. 2023","AIME : Rapidité de l'envoi - qualité du matériel

AMELIORATION : Précisions sur absence d'oreiller par rapport à la photo (juste des taies)","","","","","","24 sept. 2023","Livraison plus rapide que prévue. En revanche le jouet était dans un simple emballage plastique, heureusement qu'il n'y a pas eu de casse !","https://www.trustedshops.fr/evaluation/info_XA3F5BBDE34B5AD3FB64015EB823AC7C6.html?page=1763","https://www.trustedshops.fr/evaluation/info_XA3F5BBDE34B5AD3FB64015EB823AC7C6.html?page=19","19","https://www.trustedshops.fr/evaluation/info_XA3F5BBDE34B5AD3FB64015EB823AC7C6.html?page=18","18","https://www.trustedshops.fr/evaluation/info_XA3F5BBDE34B5AD3FB64015EB823AC7C6.html?page=20","20","https://www.trustedshops.fr/evaluation/info_XA3F5BBDE34B5AD3FB64015EB823AC7C6.html?page=18","1","https://www.trustedshops.fr/evaluation/info_XA3F5BBDE34B5AD3FB64015EB823AC7C6.html","1763","...","https://www.trustedshops.fr/evaluation/info_XA3F5BBDE34B5AD3FB64015EB823AC7C6.html?page=1763","https://www.trustedshops.fr/evaluation/info_XA3F5BBDE34B5AD3FB64015EB823AC7C6.html?page=20","https://www.trustedshops.fr/evaluation/info_XA3F5BBDE34B5AD3FB64015EB823AC7C6.html","Des","mesures","https://help.etrusted.com/hc/fr/articles/4419944605341","ont été prises pour s’assurer que les avis publiés ne proviennent que de consommateurs ayant effectivement utilisé ou acheté les marchandises ou les services.","Avis importés","n’entrent pas dans la note globale. Aucune mesure de contrôle n’a été prise.","Obtenez plus d’informations sur notre « vérification avis clients ».","Haut de page","..."
"À propos de laredoute.fr","Contact","https://www.laredoute.fr/","La Redoute vous permet d’accéder à l’art de vivre à la française au meilleur prix. Nous vous faisons gagner du temps en vous proposant les dernières tendances, des marques de qualité et les meilleurs modèles. Avec de nouvelles collections chaque semaine, il y a toujours quelque chose de nouveau à découvrir. 

Grâce à notre programme de fidélité, La Redoute +, profitez d’avantages sur la livraison, les retours gratuits, ainsi que de remises et promotions supplémentaires.

La Redoute vous donne accès aux dernières tendances de la mode, du sport et vous permet d'acheter des vêtements, des chaussures, des bijoux et d'autres accessoires. Faites vos achats parmi des centaines de marques, dont Maje, Levis, Adidas, Nike et La Redoute Collections.

Vous trouverez une large gamme de produits pour la maison et la famille avec nos marques La Redoute Intérieurs & AMPM. Découvrez les derniers meubles design, ainsi que de la literie et du linge de maison élégants, des luminaires à la mode et bien plus encore. De plus, vous pouvez équiper votre maison des appareils derniers cris. 

La Redoute se veut l'interlocuteur idéal des familles : trouvez l’inspiration et découvrez nos conseils avec les guides pour choisir vos produits !

Pour améliorer nos services, nous souhaiterions connaître votre avis. Vos commentaires sont importants pour nos clients. 88% des consommateurs lisent ces avis. Grâce à vos commentaires, nos équipes améliorent nos collections et notre relation-client.","Vers le site","LA REDOUTE SAS","avisclient@redoute.fr","https://www.trustedshops.fr/evaluation/info_XA3F5BBDE34B5AD3FB64015EB823AC7C6.html?page=20#","110, rue de Blanchemaille","59100","Roubaix","France","N° au registre du commerce","RCS Lille Métropole B 477 180 186","Représentant légal","Philippe BERLAN","Catégories","https://www.trustedshops.fr/shops/bagages_sacs_maroquinerie/","Bagages, sacs & maroquinerie","https://www.trustedshops.fr/shops/chaussures/","Chaussures","https://www.trustedshops.fr/shops/habillement/","Habillement","https://www.trustedshops.fr/shops/jouets_bebes_enfants/","Jouets, bébés & enfants","https://www.trustedshops.fr/shops/meubles_decoration/","Meubles & décoration","","","","","","","","","","","","","","","","","","","","","","","","","","","","","","","","","","","","","","","","","","","","","","","","","","","","","","","","","","","","","","","","","","","","","","","","","","","","","","","","","","","","","","","","","","","","","","","","","","","","","","","","","","","","","","","","","","","","","","","","","","","","","","","","","","","",""
"l'avis le plus positif","l'avis le plus négatif","https://www.trustedshops.fr/evaluation/info_XA3F5BBDE34B5AD3FB64015EB823AC7C6.html","","","","","","","","","","Avis pour laredoute.fr","","Pour vérifier l’authenticité","","Avis validés","","","","","","","","","","","Notre mission est de favoriser la confiance digital. Plus d’info","comment fonctionnent les avis","chez Trusted Shops.","Client de laredoute.fr","Signaler un avis","26 nov. 2022","Avis validé","Satisfaite de ma commande. Par contre très en colère et me sens flouée par le cadeau à 0 €, en cliquant vous avez le droit à une trottinette, un plein d'essence et autre chose en payant 1€ On vous dirige vers Tech VIP  sur la page d'accueil un n° de passe et sur le site de trottinette mais plein d'autres produits. donc pas de commande de ma part. Un peu naïve cliente car n'ai pas lu jusqu'en bas de la page qui spécifiait qu'au bout de 48h je devenais adhérente et que je devais payer 29,20 (somme qui m'a été débitée) et ce tous les mois pour pouvoir acheter leur produit. Heureusement j'ai pu joindre TECH VIP qui a annulé mon adhésion. Votre kdo à 0€ m'a coûté 29,90 €. Je prends cela pour du vol qualifié et une anarque. je réfléchirai pour une prochaine commande à la redoute. Cordialement Danielle DEXIDIEUX","Lire la suite","Utile","1","+1","https://www.trustedshops.fr/evaluation/info_XA3F5BBDE34B5AD3FB64015EB823AC7C6.html?stars=4&stars=5","Voir les avis positifs","23 oct. 2022","Nous avons acheté une ménagère dans un magasin et fait livré en point relai (relai colis).
Le colis devait arriver 3 jours plus tard (un mardi) ce qui nous allait bien car nous en avions besoin pour recevoir nos invités (le samedi qui suit).
Au final, le colis s’est perdu en chemin. Ni la redoute ni relai colis était capable de nous dire où il se trouvait, bien que le colis était marqué comme livré au point relai. 
Nous nous sommes déplacé dans 3 points relais différents car nous avions reçu 3 notifications. 
Le colis n’était pas présent à chaque fois. 
Un interlocuteur de chez relai colis lance une enquête pour déterminer où se trouve le colis et nous assure le traiter de toute urgence. On espérait vraiment l’avoir pour samedi…
Nous l’avons reçu finalement 7 jours plus tard après le mardi supposé livré. 
0 intérêt pour nous dans ce cas là… la ménagère est encore dans son carton tellement nous avons été déçu du temps de livraison…","3","https://www.trustedshops.fr/evaluation/info_XA3F5BBDE34B5AD3FB64015EB823AC7C6.html?stars=1&stars=2&stars=3","Voir les avis négatifs","Recherche par mot-clé","Filtre","Avis","https://www.trustedshops.fr/evaluation/info_XA3F5BBDE34B5AD3FB64015EB823AC7C6.html?stars=5","(25 359)","https://www.trustedshops.fr/evaluation/info_XA3F5BBDE34B5AD3FB64015EB823AC7C6.html?stars=4","(6 033)","https://www.trustedshops.fr/evaluation/info_XA3F5BBDE34B5AD3FB64015EB823AC7C6.html?stars=3","(1 721)","https://www.trustedshops.fr/evaluation/info_XA3F5BBDE34B5AD3FB64015EB823AC7C6.html?stars=2","(1 030)","https://www.trustedshops.fr/evaluation/info_XA3F5BBDE34B5AD3FB64015EB823AC7C6.html?stars=1","(1 103)","Tri","Pertinence","https://www.trustedshops.fr/evaluation/info_XA3F5BBDE34B5AD3FB64015EB823AC7C6.html","https://www.trustedshops.fr/evaluation/info_XA3F5BBDE34B5AD3FB64015EB823AC7C6.html?sort=date","Le plus récent d'abord","il y a 7 jours","J’ai apprécié Les articles commandés et la rapidité pour les recevoir
Commande effectué par internet le mercredi, réception le jeudi
Merci","","il y a 8 jours","Ma commande …","navigation simple et intuitive. accès aux avis. photos de qualité. infos détaillées du produit. suivi de commande sur le site et par mail.","8 oct. 2023","qualité du parcours proposé au client","Très très contente de mon achat,livraison rapide et conforme aux photos maintenant j’attends l’arrivée de mon arrière petit fils Novembre…","8 oct. 2023","l'article correspond parfaitement à la description.
a améliorer si le livreur pouvait avoir le temps de récupérer les cartons d'emballage.","2 oct. 2023","Très bien","Les livraisons domtom pr toutes les marchandises! Car nous faisons parti de la France également...à chaque fois il faut trier ou annuler..","2 oct. 2023","tres bonne expérience d'achat, navigation facile sur le site. livraison très rapide, produit de qualité correspondants à leur description.","1 oct. 2023","satisfaction totale","produit correspondant au descriptif cependant je déplore que ces articles soient aussi froissés je les lave et les repasse mais quand même","29 sept. 2023","la navigation sur le site de la redoute est très facile et pour une fois j'ai reçu des articles conformes à ma commande. livraison rapide.","RC","https://www.trustedshops.com/user/de_DE/3dbfb62310e3a71bc3d9545fbe98170e","Robert","C.","NICE","21 sept. 2023","","Rien à dire, à part la possibilité de pouvoir payer en 3 fois sans frais, sans doute la prochaine commande se fera sur un site concurrent.","MR","https://www.trustedshops.com/user/de_DE/f1be53e2307b228e494d2f6bfd7151ef","Monique","R.","Toulouse","il y a 8 jours","","J'aime la facilité de commande et de vision de la disponibilité. La rapidité de livraison. Et les retours possibles quand cela ne va pas.","6 oct. 2023","J’ai commandé deux paires de rideaux en lin, et j’ai bénéficié d’une promotion.
Donc doublement ravie par le choix du produit et le prix","6 oct. 2023","","Cette marque de draps ne m'a jamais déçue. Donc toujours ravie, le tissu le lavage 
Pour la  protection elle est conforme à mes attentes","30 sept. 2023","Bon informations sur le suivie de la commande, le produit était bien emballé. Malheureusement il manque de peinture à certains endroits.","RG","https://www.trustedshops.com/user/de_DE/379064243686f406fe71fa458212f8ca","Renate","G.","St. Julien en Genevois, France","29 sept. 2023","Temps respecté pour la livraison..
Les soutiens gorge taillent bien, confortables et belle couleur pour le gris. Je recommande ce modèle","il y a 2 jours","Depuis que je commande chez vous , j'ai toujours été livré en temps et en heure et toujours satisfait des produits . Que cela continue .","8 oct. 2023","BON SUIVI DE LA COMMANDE A TOUTES LES ETAPES
LA LIVRAISON DANS LES CASIERS A COLIS SERAIT-ELLE ENVISAGEABLE (horaires plus flexibles) ?","5 oct. 2023","J’aime beaucoup les tabourets que nous avons commandé. Correspond au descriptif. Livrés en temps et en heure. Le livreur très aimable.","Client de laredoute.fr","2 oct. 2023","","Les produits reçus ont l air de bonne qualité, à voir dans le temps. La broderie sur les taies d oreiller est un plus très appréciable.","Client de laredoute.fr","29 sept. 2023","Satisfaction complète 
Très facile de commander par internet et surtout une livraison des articles commandés extrêmement rapide 
Merci","Réponse de laredoute.fr","il y a 12 jours","Bonjour, merci d'avoir pris le temps de partager votre avis. Vos remarques nous aident à nous améliorer ! Ilham de l'équipe Service Client","Utile","","23 sept. 2023","Commande qui est arrivée en 2 colis avec un jour d' intervalle. Information manquait à ce niveau mais pas de problème, j'ai tout reçu.","https://www.trustedshops.fr/evaluation/info_XA3F5BBDE34B5AD3FB64015EB823AC7C6.html?page=1763","https://www.trustedshops.fr/evaluation/info_XA3F5BBDE34B5AD3FB64015EB823AC7C6.html?page=20","20","https://www.trustedshops.fr/evaluation/info_XA3F5BBDE34B5AD3FB64015EB823AC7C6.html?page=19","19","https://www.trustedshops.fr/evaluation/info_XA3F5BBDE34B5AD3FB64015EB823AC7C6.html?page=21","21","https://www.trustedshops.fr/evaluation/info_XA3F5BBDE34B5AD3FB64015EB823AC7C6.html?page=19","1","https://www.trustedshops.fr/evaluation/info_XA3F5BBDE34B5AD3FB64015EB823AC7C6.html","1763","...","https://www.trustedshops.fr/evaluation/info_XA3F5BBDE34B5AD3FB64015EB823AC7C6.html?page=1763","https://www.trustedshops.fr/evaluation/info_XA3F5BBDE34B5AD3FB64015EB823AC7C6.html?page=21","https://www.trustedshops.fr/evaluation/info_XA3F5BBDE34B5AD3FB64015EB823AC7C6.html","Des","mesures","https://help.etrusted.com/hc/fr/articles/4419944605341","ont été prises pour s’assurer que les avis publiés ne proviennent que de consommateurs ayant effectivement utilisé ou acheté les marchandises ou les services.","Avis importés","n’entrent pas dans la note globale. Aucune mesure de contrôle n’a été prise.","Obtenez plus d’informations sur notre « vérification avis clients ».","Haut de page","..."
"À propos de laredoute.fr","Contact","https://www.laredoute.fr/","La Redoute vous permet d’accéder à l’art de vivre à la française au meilleur prix. Nous vous faisons gagner du temps en vous proposant les dernières tendances, des marques de qualité et les meilleurs modèles. Avec de nouvelles collections chaque semaine, il y a toujours quelque chose de nouveau à découvrir. 

Grâce à notre programme de fidélité, La Redoute +, profitez d’avantages sur la livraison, les retours gratuits, ainsi que de remises et promotions supplémentaires.

La Redoute vous donne accès aux dernières tendances de la mode, du sport et vous permet d'acheter des vêtements, des chaussures, des bijoux et d'autres accessoires. Faites vos achats parmi des centaines de marques, dont Maje, Levis, Adidas, Nike et La Redoute Collections.

Vous trouverez une large gamme de produits pour la maison et la famille avec nos marques La Redoute Intérieurs & AMPM. Découvrez les derniers meubles design, ainsi que de la literie et du linge de maison élégants, des luminaires à la mode et bien plus encore. De plus, vous pouvez équiper votre maison des appareils derniers cris. 

La Redoute se veut l'interlocuteur idéal des familles : trouvez l’inspiration et découvrez nos conseils avec les guides pour choisir vos produits !

Pour améliorer nos services, nous souhaiterions connaître votre avis. Vos commentaires sont importants pour nos clients. 88% des consommateurs lisent ces avis. Grâce à vos commentaires, nos équipes améliorent nos collections et notre relation-client.","Vers le site","LA REDOUTE SAS","avisclient@redoute.fr","https://www.trustedshops.fr/evaluation/info_XA3F5BBDE34B5AD3FB64015EB823AC7C6.html?page=21#","110, rue de Blanchemaille","59100","Roubaix","France","N° au registre du commerce","RCS Lille Métropole B 477 180 186","Représentant légal","Philippe BERLAN","Catégories","https://www.trustedshops.fr/shops/bagages_sacs_maroquinerie/","Bagages, sacs & maroquinerie","https://www.trustedshops.fr/shops/chaussures/","Chaussures","https://www.trustedshops.fr/shops/habillement/","Habillement","https://www.trustedshops.fr/shops/jouets_bebes_enfants/","Jouets, bébés & enfants","https://www.trustedshops.fr/shops/meubles_decoration/","Meubles & décoration","","","","","","","","","","","","","","","","","","","","","","","","","","","","","","","","","","","","","","","","","","","","","","","","","","","","","","","","","","","","","","","","","","","","","","","","","","","","","","","","","","","","","","","","","","","","","","","","","","","","","","","","","","","","","","","","","","","","","","","","","","","","","","","","","","","",""
