"Heading-sc-1w8ymiq-0","Heading-sc-1w8ymiq-0 2","Linkstyles__LinkAsButton-sc-1h68u9x-1 href","sc-5ee3e300-1","sc-5ee3e300-3","sc-50bba857-10","sc-50bba857-7","sc-50bba857-7 href","sc-50bba857-6","sc-50bba857-6 2","sc-50bba857-6 3","sc-50bba857-6 4","Heading-sc-1w8ymiq-0 3","sc-50bba857-3","Heading-sc-1w8ymiq-0 4","sc-50bba857-3 2","Heading-sc-1w8ymiq-0 5","sc-18832e28-0 href","sc-18832e28-1","sc-18832e28-0 href 2","sc-18832e28-1 2","sc-18832e28-0 href 3","sc-18832e28-1 3","sc-18832e28-0 href 4","sc-18832e28-1 4","sc-18832e28-0 href 5","sc-18832e28-1 5","sc-479b2e8f-0","sc-479b2e8f-2","sc-479b2e8f-0 2","sc-9a1a1d31-3","sc-5ba92e33-1","sc-da9d5f14-0","sc-8e4177af-1","sc-1d9707d8-3","sc-1d9707d8-7","Buttonstyles__Button-sc-1tf6032-0","sc-1363a757-0","sc-aecd9dde-3","sc-fbe7dd0b-0 href","text-link","sc-da9d5f14-0 2","sc-1d9707d8-3 2","sc-1363a757-0 2","sc-fbe7dd0b-0 href 2","text-link 2","SearchFieldstyles__SearchField-sc-yxor04-1","sc-a9533a8f-0","sc-2e7612c5-0","sc-2e7612c5-0 href","sc-b63496bf-0","sc-2e7612c5-0 href 2","sc-b63496bf-0 2","sc-2e7612c5-0 href 3","sc-b63496bf-0 3","sc-2e7612c5-0 href 4","sc-b63496bf-0 4","sc-2e7612c5-0 href 5","sc-b63496bf-0 5","sc-6673f4bd-2","sc-a9533a8f-0 2","sc-f50673af-0 href","sc-f50673af-0 href 2","sc-6fa249cb-0 2","sc-da9d5f14-0 3","sc-e3ea776e-1","sc-e3ea776e-2","sc-da9d5f14-0 4","sc-e3ea776e-3","sc-e3ea776e-1 2","sc-da9d5f14-0 5","sc-e3ea776e-3 2","sc-e3ea776e-1 3","sc-da9d5f14-0 6","sc-e3ea776e-1 4","sc-da9d5f14-0 7","sc-e3ea776e-3 3","sc-e3ea776e-1 5","sc-da9d5f14-0 8","sc-e3ea776e-1 6","sc-da9d5f14-0 9","sc-e3ea776e-3 4","sc-e3ea776e-1 7","sc-da9d5f14-0 10","sc-e3ea776e-1 8","sc-d91afe17-3","sc-d91afe17-2 href","sc-d91afe17-1","sc-d91afe17-1 2","sc-d91afe17-4","sc-da9d5f14-0 11","sc-e3ea776e-3 5","sc-e3ea776e-1 9","sc-d91afe17-3 2","sc-d91afe17-2 href 2","sc-d91afe17-1 3","sc-d91afe17-1 4","sc-d91afe17-4 2","sc-da9d5f14-0 12","sc-e3ea776e-3 6","sc-e3ea776e-1 10","sc-da9d5f14-0 13","sc-e3ea776e-1 11","sc-da9d5f14-0 14","sc-e3ea776e-3 7","sc-e3ea776e-1 12","sc-da9d5f14-0 15","sc-e3ea776e-1 13","sc-d91afe17-3 3","sc-d91afe17-2 href 3","sc-d91afe17-1 5","sc-d91afe17-1 6","sc-d91afe17-4 3","sc-da9d5f14-0 16","sc-e3ea776e-1 14","sc-da9d5f14-0 17","sc-e3ea776e-1 15","sc-da9d5f14-0 18","sc-e3ea776e-1 16","sc-da9d5f14-0 19","sc-e3ea776e-1 17","sc-9a1a1d31-3 17","sc-da9d5f14-0 20","sc-e3ea776e-3 8","sc-e3ea776e-1 18","sc-9a1a1d31-3 18","sc-da9d5f14-0 21","sc-e3ea776e-1 19","sc-c713902e-0","Tooltipstyles__TooltipWrapper-sc-n4shmz-0","sc-4f648aee-1","Buttonstyles__Button-sc-1tf6032-0 22","sc-9a1a1d31-3 19","sc-da9d5f14-0 22","sc-e3ea776e-1 20","Linkstyles__LinkAsButton-sc-1h68u9x-1 href 2","Linkstyles__LinkAsButton-sc-1h68u9x-1 href 3","Linkstyles__LinkAsButton-sc-1h68u9x-1","Linkstyles__LinkAsButton-sc-1h68u9x-1 href 4","Linkstyles__LinkAsButton-sc-1h68u9x-1 2","Linkstyles__LinkAsButton-sc-1h68u9x-1 href 5","Linkstyles__LinkAsButton-sc-1h68u9x-1 3","Linkstyles__LinkAsButton-sc-1h68u9x-1 href 6","Linkstyles__LinkAsButton-sc-1h68u9x-1 4","Linkstyles__LinkAsButton-sc-1h68u9x-1 href 7","Linkstyles__LinkAsButton-sc-1h68u9x-1 5","Paginationstyles__Ellipsis-sc-1uibxtv-2","Linkstyles__LinkAsButton-sc-1h68u9x-1 href 9","Linkstyles__LinkAsButton-sc-1h68u9x-1 href 10","Linkstyles__LinkAsButton-sc-1h68u9x-1 href 11","sc-6911c4c0-4","sc-6911c4c0-11","sc-6911c4c0-11 href","sc-6911c4c0-4 2","Heading-sc-1w8ymiq-0 6","sc-6911c4c0-4 3","sc-fbe7dd0b-0","sc-6911c4c0-1","Paginationstyles__Ellipsis-sc-1uibxtv-2 2"
": 79 323","Très bien","","","","","","","","","","","","","","","","","","","","","","","","","","","","","","","","","","","","","","","","","","","","","","","","","","","","","","","","","","","","","","","","","","","","","","","","","","","","","","","","","","","","","","","","","","","","","","","","","","","","","","","","","","","","","","","","","","","","","","","","","","","","","","","","","","","","","","","","","","","","","","","","","","","","","","","","","","","","",""
"","","https://www.laredoute.fr/","","","","","","","","","","","","","","","","","","","","","","","","","","","","","","","","","","","","","","","","","","","","","","","","","","","","","","","","","","","","","","","","","","","","","","","","","","","","","","","","","","","","","","","","","","","","","","","","","","","","","","","","","","","","","","","","","","","","","","","","","","","","","","","","","","","","","","","","","","","","","","","","","","","","","","","","","","","",""
"À propos de laredoute.fr","Contact","https://www.laredoute.fr/","La Redoute vous permet d’accéder à l’art de vivre à la française au meilleur prix. Nous vous faisons gagner du temps en vous proposant les dernières tendances, des marques de qualité et les meilleurs modèles. Avec de nouvelles collections chaque semaine, il y a toujours quelque chose de nouveau à découvrir. 

Grâce à notre programme de fidélité, La Redoute +, profitez d’avantages sur la livraison, les retours gratuits, ainsi que de remises et promotions supplémentaires.

La Redoute vous donne accès aux dernières tendances de la mode, du sport et vous permet d'acheter des vêtements, des chaussures, des bijoux et d'autres accessoires. Faites vos achats parmi des centaines de marques, dont Maje, Levis, Adidas, Nike et La Redoute Collections.

Vous trouverez une large gamme de produits pour la maison et la famille avec nos marques La Redoute Intérieurs & AMPM. Découvrez les derniers meubles design, ainsi que de la literie et du linge de maison élégants, des luminaires à la mode et bien plus encore. De plus, vous pouvez équiper votre maison des appareils derniers cris. 

La Redoute se veut l'interlocuteur idéal des familles : trouvez l’inspiration et découvrez nos conseils avec les guides pour choisir vos produits !

Pour améliorer nos services, nous souhaiterions connaître votre avis. Vos commentaires sont importants pour nos clients. 88% des consommateurs lisent ces avis. Grâce à vos commentaires, nos équipes améliorent nos collections et notre relation-client.","Vers le site","LA REDOUTE SAS","avisclient@redoute.fr","https://www.trustedshops.fr/evaluation/info_XA3F5BBDE34B5AD3FB64015EB823AC7C6.html#","110, rue de Blanchemaille","59100","Roubaix","France","N° au registre du commerce","RCS Lille Métropole B 477 180 186","Représentant légal","Philippe BERLAN","Catégories","https://www.trustedshops.fr/shops/bagages_sacs_maroquinerie/","Bagages, sacs & maroquinerie","https://www.trustedshops.fr/shops/chaussures/","Chaussures","https://www.trustedshops.fr/shops/habillement/","Habillement","https://www.trustedshops.fr/shops/jouets_bebes_enfants/","Jouets, bébés & enfants","https://www.trustedshops.fr/shops/meubles_decoration/","Meubles & décoration","","","","","","","","","","","","","","","","","","","","","","","","","","","","","","","","","","","","","","","","","","","","","","","","","","","","","","","","","","","","","","","","","","","","","","","","","","","","","","","","","","","","","","","","","","","","","","","","","","","","","","","","","","","","","","","","","","","","","","","","","","","","","","","","","","","",""
"Avis pour laredoute.fr","35 246 avis validés au cours des 12 derniers mois","","","","","","","","","","","","","","","","","","","","","","","","","","","","","","","","","","","","","","","","","","","","","","","","","","","","","","","","","","","","","","","","","","","","","","","","","","","","","","","","","","","","","","","","","","","","","","","","","","","","","","","","","","","","","","","","","","","","","","","","","","","","","","","","","","","","","","","","","","","","","","","","","","","","","","","","","","","","",""
"l'avis le plus positif","l'avis le plus négatif","https://www.trustedshops.fr/evaluation/info_XA3F5BBDE34B5AD3FB64015EB823AC7C6.html","","","","","","","","","","Avis pour laredoute.fr","","Pour vérifier l’authenticité","","Avis validés","","","","","","","","","","","Notre mission est de favoriser la confiance digital. Plus d’info","comment fonctionnent les avis","chez Trusted Shops.","Client de laredoute.fr","Signaler un avis","26 nov. 2022","Avis validé","Satisfaite de ma commande. Par contre très en colère et me sens flouée par le cadeau à 0 €, en cliquant vous avez le droit à une trottinette, un plein d'essence et autre chose en payant 1€ On vous dirige vers Tech VIP  sur la page d'accueil un n° de passe et sur le site de trottinette mais plein d'autres produits. donc pas de commande de ma part. Un peu naïve cliente car n'ai pas lu jusqu'en bas de la page qui spécifiait qu'au bout de 48h je devenais adhérente et que je devais payer 29,20 (somme qui m'a été débitée) et ce tous les mois pour pouvoir acheter leur produit. Heureusement j'ai pu joindre TECH VIP qui a annulé mon adhésion. Votre kdo à 0€ m'a coûté 29,90 €. Je prends cela pour du vol qualifié et une anarque. je réfléchirai pour une prochaine commande à la redoute. Cordialement Danielle DEXIDIEUX","Lire la suite","Utile","1","+1","https://www.trustedshops.fr/evaluation/info_XA3F5BBDE34B5AD3FB64015EB823AC7C6.html?stars=4&stars=5","Voir les avis positifs","23 oct. 2022","Nous avons acheté une ménagère dans un magasin et fait livré en point relai (relai colis).
Le colis devait arriver 3 jours plus tard (un mardi) ce qui nous allait bien car nous en avions besoin pour recevoir nos invités (le samedi qui suit).
Au final, le colis s’est perdu en chemin. Ni la redoute ni relai colis était capable de nous dire où il se trouvait, bien que le colis était marqué comme livré au point relai. 
Nous nous sommes déplacé dans 3 points relais différents car nous avions reçu 3 notifications. 
Le colis n’était pas présent à chaque fois. 
Un interlocuteur de chez relai colis lance une enquête pour déterminer où se trouve le colis et nous assure le traiter de toute urgence. On espérait vraiment l’avoir pour samedi…
Nous l’avons reçu finalement 7 jours plus tard après le mardi supposé livré. 
0 intérêt pour nous dans ce cas là… la ménagère est encore dans son carton tellement nous avons été déçu du temps de livraison…","3","https://www.trustedshops.fr/evaluation/info_XA3F5BBDE34B5AD3FB64015EB823AC7C6.html?stars=1&stars=2&stars=3","Voir les avis négatifs","Recherche par mot-clé","Filtre","Avis","https://www.trustedshops.fr/evaluation/info_XA3F5BBDE34B5AD3FB64015EB823AC7C6.html?stars=5","(25 359)","https://www.trustedshops.fr/evaluation/info_XA3F5BBDE34B5AD3FB64015EB823AC7C6.html?stars=4","(6 033)","https://www.trustedshops.fr/evaluation/info_XA3F5BBDE34B5AD3FB64015EB823AC7C6.html?stars=3","(1 721)","https://www.trustedshops.fr/evaluation/info_XA3F5BBDE34B5AD3FB64015EB823AC7C6.html?stars=2","(1 030)","https://www.trustedshops.fr/evaluation/info_XA3F5BBDE34B5AD3FB64015EB823AC7C6.html?stars=1","(1 103)","Tri","Pertinence","https://www.trustedshops.fr/evaluation/info_XA3F5BBDE34B5AD3FB64015EB823AC7C6.html","https://www.trustedshops.fr/evaluation/info_XA3F5BBDE34B5AD3FB64015EB823AC7C6.html?sort=date","Le plus récent d'abord","5 oct. 2023","Facilte, sollicitations dosées...qualité..on pourrait cependant améliorer le volet recap commandes sur l'appli avec au moment de la livraison, lorsque vos propres équipes ou des intervenants autres communiquent avec nous un rappel systématique du contenu de la commande et son numéro la Redoute. Les sociétés de livraison ont leur code, c'est bien mais quand, comme moi, on commande beaucoup avec des modes de livraison différents et de manière rythmes c est sportif. Par ailleurs ce serait bien que vos sociétés de livraison, quand elles livrent pour vous, alignent le look de leurs mails ou autres type de communication sur le vôtre.  Le service serait parfait de bout en bout.  Concernant les marques autres que les vôtres que vous distribuez et qui se chargent de livrer vous annoncez parfois des dates de livraison qui ne correspondent pas ...en général c'est livré avant certes mais nous achetons chez vois donc vous devriez être informés par elles dès vraies dates de livraison...
Pour nous il n'y a QUE LA Redoute. Le reste est transparent.","Afficher plus","2 oct. 2023","Jolie table mais plus pour 6 que pour 8","Livraison impeccable avec possibilité de prendre RDV même le samedi matin. 
Ce serait bien par contre d’avoir les dimensions des colis au cas où l’on puisse aller chercher les meubles au dépôt local du transporteur. 

La table est très jolie et super facile à monter. Une dizaine de vis. Dommage que les vis les plus au bord ne soient pas plus excentrées des pieds. Avec 2-3 cm de okus on pourrait oasser une visseuse sans problème. C’estbun petit détail. 
Pour 4 ou 6 personnes aucun problème. Pour 8, c’est un peu (très) serré. On trouvera des tabourets pour les grands repas à 7 ou 8. Avec des chaises, les 8 convives ne passeront pas. A voir si on peu ajouter une allonge. On regardera mieux les dimensions de la fiche technique la prochaine fois. On ne peut pas faire confiance à l’indication du nombre de convive indiquée en ligne. On le saura pour notre future table de jardin.","il y a 9 jours","excellent  site mais des changements qui compliquent les commandes","je commande depuis longtemps chez la redoute; j'y appréciais le choix , la rapidité de livraison et la facilité de règlement grace à la carte ,meme si presque  a chaque fois je demandais un règlement comptant cela m'évitait de laisser mon numéro de carte bleue  sur le web ...par contre depuis quelques jours cela a changé je n'y comprends plus rien je ne peux plus payer comme ça alors que  je n'ai absolument  aucun débit  en attente sur mon compte ....du coup par sécurité face a l'internet  j'ai dû régler  mes deux dernières commandes avec une carte bancaire à usage unique ce qui est un peu  plus compliqué pour moi et risque  forcement de me faire hésiter pour des   futurs  achats sur ce site....dommage.","il y a 3 jours","Livraison rapide, facilité pour retourner un article qui ne convient pas 

Suggestion : 1- certains sites marchands propose un calcul de la taille la plus adaptée à sa morphologie, ça aide bien car en fonction des marques la taille peut être différente et aussi selon la coupe parfois un S est mieux qu’un M etc…même si je regarde les avis ou parfois les gens indiquent si l’article taille grand ou petit, c.est pas toujours évident 
2- pour le retour, il y avait un choix très limité de relais colis, il y en avait beaucoup plus avant autour de chez moi. En plus la ou je suis allée ( que je connais et encore assez pratique pour moi) a des horaires peu pratiques quand on travaille ( ferme à 17h30)","26 sept. 2023","Bon commerçant, mais et l'environnement ?","Bon prix, produit expédié rapidement et reçu rapidement, pas trop d'emballage. Comme l'avis demandé semble porter sur l'ensemble du site, j'en profite pour suggérer une plus grande attention à l'environnement dans les produits choisis : choix des matériaux (éviter le plastique par exemple, favoriser le bois, le métal, le verre, les tissus 100% naturels). Prêter attention aux labels de qualité (FSC pour le bois, bio pour le textile naturel, etc...) et mettre en avant les conditions de fabrication (pays d'origine, conditions des salariés,...).","il y a 12 jours","Beaucoup de facilité pour commander. Description de l’objet précise. Livraison très rapide en Relay colis. Facilité également pour se faire rembourser si ça ne va pas. Tout est bien.
Le seul problème c’est le paiement car j’ai un compte Sofinco avec paiement le mois suivant avec virement. J’utilisais ce dispositif avant, mais maintenant ce n’est plus possible. Je ne peux utiliser que Paypal qui propose paiement en 4 fois mais ça ne fonctionne pas, c’est toujours un paiement intégral. Du coup, j’ai peur de commander…
C’est dommage…","5 oct. 2023","A quoi bon choisir un point de livraison si La Redoute ne respecte pas mon choix?","Cela fait plusieurs fois que La Redoute envoie mon colis ailleurs que dans le relais colis que j'ai choisi, sous prétexte que la livraison a été plus rapide que prévue et que mon relais colis est fermé le samedi.
Résultat, au lieu d'aller chercher mon colis dans la rue à côté de chez moi, à pied, je suis obligée de passer 30 mn ( 15 mn aller, 15 mn retour) en voiture pour aller chercher mon paquet dans un endroit plus éloigné de mon domicile, que je n'ai pas choisi, qui parfois n'est même pas sur ma commune.","26 sept. 2023","Achat de vêtements en ligne facile à faire, le site est très bien fait et permet de voir les photos de bonne qualité car les descriptions manquent parfois de détails ou sont erronés (par exemple : robe à encolure carrée alors que l'image montre clairement que c'est une encolure en V). La description gagnerait à être faite par un professionnel du vêtement et non un commercial !  La livraison est rapide et sans problème en général sauf quelquefois les vêtements sont quand même assez froissés à la réception.","MC","https://www.trustedshops.com/user/de_DE/9a14364e346d73167002ba1476a925ee","Marie","C.","Meudon","il y a 9 jours","Révision des couleurs représentées par les macarons-échantillons","Le site la Redoute est sûr, d'autant plus que ses descriptions sur les produits sont claires et détaillées ce qui permet un choix précis, cependant il y a un petit dilemme ce sont les macarons définissant les couleurs des articles, en général erronées mais heureusement les photos correspondent bien à ceux-ci, est-ce dû à la période de pandémie où le personnel avait un manque de temps ? Mais beaucoup d'autres sites reproduisent les mêmes erreurs sur les macarons-échantillons colorés devenus non fiable !","PB","https://www.trustedshops.com/user/de_DE/c9654ec4b2ad501f244650992af65b31","Paule","B.","JOUQUES","7 oct. 2023","FELICITATIONS !","Les articles proposés sont de bonne qualité et toujours d'un excellent rapport qualité/prix pour tous les âges et tous les goûts.
Le site de la Redoute est facile à consulter et les articles bien décrits.
Cerise sur le gâteau, des articles de nombreuses marques réputées sont présentés à des prix compétitifs et viennent ainsi compléter La Redoute Collections et La Redoute maison.
Le suivi de commande est parfait ainsi que la livraison par la poste ou en relais-colis.
FELICITATIONS ! Continuez ainsi","il y a 2 jours","Rapidité, informations sur la livraison très bien

Faire de mieux : revoir la notice de montage du meuble Meuble TV/Hifi vintage, Watford, Réf 4570429. En effet il y a 1 vis qui a un emplacement spécifique et qui n'est pas suffisamment signalé d- e notre point de vue. C'est ainsi que nous avons fendu une partie du côté de notre meuble tout neuf. Bref signaler en rouge et en gros cette vis pour les prochains utilisateurs !! heureuqement on a pu recoller, mais ce n'est plus pareil…","il y a 12 jours","Montage du meuble","Commande, suivi, délais, livraison.... bons.
Produit: bureau NIZOU mauvais positionnement des 4 boulons de fixation du bloc tiroir sur le panneau d'habillage latéral vertical.
Les 2 trous du hauts sont bien positionnés, mais les 2 du bas sont légèrement désaxés par rapport aux réservations du bloc tiroirs. j'ai pu rattraper le coup pour le 3ème boulon, mais impossible d'aligner le quatrième. (heureusement ça tient avec 3). Conclusion: serrer la vis de vos fournisseurs chinois !","il y a 7 jours","J'ai tout aimé comme d'habitude, simplicité et rapidité de la commande,choix des vêtements proposés et propositions bien ciblées.J'ai cette fois ci été déçue par la couleur d'un chemisier à fleurs qui sur la photo paraissaient nettement bleues et ce sont avérées mauves à l'arrivée.Le renvoi a heureusement été simple mais malheureusement beaucoup plus loin que du relais pick-up où j'ai reçu ma commande.
Je préférai que vous annonciez très clairement les couleurs .
Merci beaucoup.","CB","https://www.trustedshops.com/user/de_DE/8a222bb33e335bb0d829a113cdad3ff3","Chris","B.","Valsonne","28 sept. 2023","J'ai aimé la disponibilité du produit commandé, ainsi que la livraison à domicile.
J'ai déploré le comportement du livreur, très pressé, qui n'a pas pris le temps de lire le bon de LIVRAISON ( retour de l'ancien matelas que j'avais vu par Messenger et qui a été RAJOUTE à la commande). 
La mention de reprise de l'ancien objet livré, n'est pas précisé lors de la validation de la commande; vous en faite mention dans le descriptif du produit vendu et après PPFFTT,  plus rien.","il y a 7 jours","J’étais septique en l’achetant notamment en lisant certains commentaires qui le décrive moue. Effectivement à réception je l’ai trouvé très moelleux et j’ai eu peur qui ne maintienne pas bien ma nuque. Mais dès la première utilisation j’ai passé une très bonne nuit. Je dois dire que depuis une semaine je redore comme un bébé. J’ai vais mal aux cervicales et au dos le matin et depuis plus rien même mon bas du dos n’est plus tenu. Je recommande vivement cet oreiller.","5 oct. 2023","produits de marque La Redoute sympa, parfois prix un peu élevé pour la qualité, souvent des tissus fins, mais il y a souvent des réductions donc cela compense
Beaucoup de choix de marque avec prix intéressant aussi
PAR CONTRE plusieurs fois, et encore cette dernière commande, je reçois un produit presque pareil à celui commandé mais pas tout à fait, la photo sur le site n'est pas conforme ou alors l'article envoyé n'est pas bon, en tout cas cela arrive trop souvent","il y a 11 jours","Magnifique maillot de bain !
 Sobre mais  sexy à la fois  !  juste ce qu’il faut  😉
Aussi jolie et qualitatif qu’un maillot de bain de grande marque !  
Je le rachète pour la 2eme fois mais en  taille 40 suite à une augmentation mammaire (94cm de poitrine, un petit bonnet D)  
J’avais ce même maillot de bain en taille « 38 » qui va très bien je pense  jusqu’à un bonnet C 
Mes mensurations (tour de taille 70/71cm / tour de hanche 95/96 cm / tour de poitrine 96cm","Client de laredoute.fr","il y a 22 heures","Jambe de pantalon très grande","Je suis très satisfaite  de certain article commandé sauf d'un pantalon de laine qui semble fait pour des femmes d'1m75 ou plus , avec mon mètre60, il m'est impossible de le porter dans l'état, en effet il me faudrait couper et ourler celui-ci,
dans un tricot cela semble un peu risqué ! Le résultat serait peu satisfaisant je pense.
Pourquoi ne pas  proposer deux tailles, pour les femmes de ma taille et les autres. Dommage ce pantalon me plaisait bien !","Client de laredoute.fr","il y a 13 jours","Bonjour, 
Particulièrement aimé la rapidité de l'envoi de ma commande. 
Mais je n'ai pas vue le transporteur, qui a mis mon colis directement dans la boîte au lettre, ceux qui peut être pas très judicieux car si mon colis avait disparu, aucun moyen pour moi pour justifier car également valider sur le suivi Web, pour les prochaines commandes, veiller à ce que le livreur respecte les consignes ? 
En vous remerciant par avance, cordialement, C.Wosynski.","Réponse de laredoute.fr","il y a 5 jours","Bonjour, merci d'avoir pris le temps de nous partager votre avis. La Redoute ayant à cœur de répondre au mieux aux attentes de ses clients, nous ferons remonter votre commentaire afin d'améliorer nos services. Nous nous excusons de nouveau pour ce désagrément. Ilham de l'équipe Service Client.","Utile","Client de laredoute.fr","26 sept. 2023","Parfaitement bien organisé … quand vos livreurs arrivent à livrer le colis ! 

Je suis toujours en attente d’un puzzle qui n’a pas été livré sous prétexte que mon adresse est incomplète : 
or tous les autres articles de ma commande sont arrivés à mon adresse ! 
Comme dh’abtiude ! 
J’ai fait une réclamation mais aucune nouvelle à ce jour. 
Si vous pouvez m’aider à réceptionner mon colis … merci 
Ce n’est pas sérieux de leur part.","https://www.trustedshops.fr/evaluation/info_XA3F5BBDE34B5AD3FB64015EB823AC7C6.html","https://www.trustedshops.fr/evaluation/info_XA3F5BBDE34B5AD3FB64015EB823AC7C6.html","1","https://www.trustedshops.fr/evaluation/info_XA3F5BBDE34B5AD3FB64015EB823AC7C6.html?page=2","2","https://www.trustedshops.fr/evaluation/info_XA3F5BBDE34B5AD3FB64015EB823AC7C6.html?page=3","3","https://www.trustedshops.fr/evaluation/info_XA3F5BBDE34B5AD3FB64015EB823AC7C6.html?page=4","4","https://www.trustedshops.fr/evaluation/info_XA3F5BBDE34B5AD3FB64015EB823AC7C6.html?page=5","5","...","https://www.trustedshops.fr/evaluation/info_XA3F5BBDE34B5AD3FB64015EB823AC7C6.html?page=1763","https://www.trustedshops.fr/evaluation/info_XA3F5BBDE34B5AD3FB64015EB823AC7C6.html?page=2","https://www.trustedshops.fr/evaluation/info_XA3F5BBDE34B5AD3FB64015EB823AC7C6.html?page=1763","Des","mesures","https://help.etrusted.com/hc/fr/articles/4419944605341","ont été prises pour s’assurer que les avis publiés ne proviennent que de consommateurs ayant effectivement utilisé ou acheté les marchandises ou les services.","Avis importés","n’entrent pas dans la note globale. Aucune mesure de contrôle n’a été prise.","Obtenez plus d’informations sur notre « vérification avis clients ».","Haut de page",""
