"À propos de laredoute.fr","Contact","https://www.laredoute.fr/","La Redoute vous permet d’accéder à l’art de vivre à la française au meilleur prix. Nous vous faisons gagner du temps en vous proposant les dernières tendances, des marques de qualité et les meilleurs modèles. Avec de nouvelles collections chaque semaine, il y a toujours quelque chose de nouveau à découvrir. 

Grâce à notre programme de fidélité, La Redoute +, profitez d’avantages sur la livraison, les retours gratuits, ainsi que de remises et promotions supplémentaires.

La Redoute vous donne accès aux dernières tendances de la mode, du sport et vous permet d'acheter des vêtements, des chaussures, des bijoux et d'autres accessoires. Faites vos achats parmi des centaines de marques, dont Maje, Levis, Adidas, Nike et La Redoute Collections.

Vous trouverez une large gamme de produits pour la maison et la famille avec nos marques La Redoute Intérieurs & AMPM. Découvrez les derniers meubles design, ainsi que de la literie et du linge de maison élégants, des luminaires à la mode et bien plus encore. De plus, vous pouvez équiper votre maison des appareils derniers cris. 

La Redoute se veut l'interlocuteur idéal des familles : trouvez l’inspiration et découvrez nos conseils avec les guides pour choisir vos produits !

Pour améliorer nos services, nous souhaiterions connaître votre avis. Vos commentaires sont importants pour nos clients. 88% des consommateurs lisent ces avis. Grâce à vos commentaires, nos équipes améliorent nos collections et notre relation-client.","Vers le site","LA REDOUTE SAS","avisclient@redoute.fr","https://www.trustedshops.fr/evaluation/info_XA3F5BBDE34B5AD3FB64015EB823AC7C6.html?page=13#","110, rue de Blanchemaille","59100","Roubaix","France","N° au registre du commerce","RCS Lille Métropole B 477 180 186","Représentant légal","Philippe BERLAN","Catégories","https://www.trustedshops.fr/shops/bagages_sacs_maroquinerie/","Bagages, sacs & maroquinerie","https://www.trustedshops.fr/shops/chaussures/","Chaussures","https://www.trustedshops.fr/shops/habillement/","Habillement","https://www.trustedshops.fr/shops/jouets_bebes_enfants/","Jouets, bébés & enfants","https://www.trustedshops.fr/shops/meubles_decoration/","Meubles & décoration","","","","","","","","","","","","","","","","","","","","","","","","","","","","","","","","","","","","","","","","","","","","","","","","","","","","","","","","","","","","","","","","","","","","","","","","","","","","","","","","","","","","","","","","","","","","","","","","","","","","","","","","","","","","","","","","","","","","","","","","","","","","","","","","","","","",""
"l'avis le plus positif","l'avis le plus négatif","https://www.trustedshops.fr/evaluation/info_XA3F5BBDE34B5AD3FB64015EB823AC7C6.html","","","","","","","","","","Avis pour laredoute.fr","","Pour vérifier l’authenticité","","Avis validés","","","","","","","","","","","Notre mission est de favoriser la confiance digital. Plus d’info","comment fonctionnent les avis","chez Trusted Shops.","Client de laredoute.fr","Signaler un avis","26 nov. 2022","Avis validé","Satisfaite de ma commande. Par contre très en colère et me sens flouée par le cadeau à 0 €, en cliquant vous avez le droit à une trottinette, un plein d'essence et autre chose en payant 1€ On vous dirige vers Tech VIP  sur la page d'accueil un n° de passe et sur le site de trottinette mais plein d'autres produits. donc pas de commande de ma part. Un peu naïve cliente car n'ai pas lu jusqu'en bas de la page qui spécifiait qu'au bout de 48h je devenais adhérente et que je devais payer 29,20 (somme qui m'a été débitée) et ce tous les mois pour pouvoir acheter leur produit. Heureusement j'ai pu joindre TECH VIP qui a annulé mon adhésion. Votre kdo à 0€ m'a coûté 29,90 €. Je prends cela pour du vol qualifié et une anarque. je réfléchirai pour une prochaine commande à la redoute. Cordialement Danielle DEXIDIEUX","Lire la suite","Utile","1","+1","https://www.trustedshops.fr/evaluation/info_XA3F5BBDE34B5AD3FB64015EB823AC7C6.html?stars=4&stars=5","Voir les avis positifs","23 oct. 2022","Nous avons acheté une ménagère dans un magasin et fait livré en point relai (relai colis).
Le colis devait arriver 3 jours plus tard (un mardi) ce qui nous allait bien car nous en avions besoin pour recevoir nos invités (le samedi qui suit).
Au final, le colis s’est perdu en chemin. Ni la redoute ni relai colis était capable de nous dire où il se trouvait, bien que le colis était marqué comme livré au point relai. 
Nous nous sommes déplacé dans 3 points relais différents car nous avions reçu 3 notifications. 
Le colis n’était pas présent à chaque fois. 
Un interlocuteur de chez relai colis lance une enquête pour déterminer où se trouve le colis et nous assure le traiter de toute urgence. On espérait vraiment l’avoir pour samedi…
Nous l’avons reçu finalement 7 jours plus tard après le mardi supposé livré. 
0 intérêt pour nous dans ce cas là… la ménagère est encore dans son carton tellement nous avons été déçu du temps de livraison…","3","https://www.trustedshops.fr/evaluation/info_XA3F5BBDE34B5AD3FB64015EB823AC7C6.html?stars=1&stars=2&stars=3","Voir les avis négatifs","Recherche par mot-clé","Filtre","Avis","https://www.trustedshops.fr/evaluation/info_XA3F5BBDE34B5AD3FB64015EB823AC7C6.html?stars=5","(25 359)","https://www.trustedshops.fr/evaluation/info_XA3F5BBDE34B5AD3FB64015EB823AC7C6.html?stars=4","(6 033)","https://www.trustedshops.fr/evaluation/info_XA3F5BBDE34B5AD3FB64015EB823AC7C6.html?stars=3","(1 721)","https://www.trustedshops.fr/evaluation/info_XA3F5BBDE34B5AD3FB64015EB823AC7C6.html?stars=2","(1 030)","https://www.trustedshops.fr/evaluation/info_XA3F5BBDE34B5AD3FB64015EB823AC7C6.html?stars=1","(1 103)","Tri","Pertinence","https://www.trustedshops.fr/evaluation/info_XA3F5BBDE34B5AD3FB64015EB823AC7C6.html","https://www.trustedshops.fr/evaluation/info_XA3F5BBDE34B5AD3FB64015EB823AC7C6.html?sort=date","Le plus récent d'abord","25 sept. 2023","Rapidité d' envoi. Mais 4☆ et non 5 car pas de confirmation de commande, ni sur ma boîte mail ni dans les spams. Mais réactivité devant ma demande d'information et amabilité.","Afficher plus","il y a 7 jours","Satisfaction","J'ai redécouvert depuis peu la redoute, je suis agréablement surprise du choix des articles. En effet je trouve toujours ce que je veux a la redoute. Je recommande vivement","il y a 10 jours","Beaucoup de choix, bonne qualité","Beaucoup de choix, j'ai trouvé ce que je cherchais à un très bon rapport qualité prix car il y avait une promotion.
Je souhaiterais plus de vêtements en matières naturelles.","il y a 10 jours","Le plus: la livraison rapide. La disponibilité des articles.
Le moins: Pour une précédente commande, le remboursement a été effectué après 3 mois et seulement à ma demande!!","il y a 6 jours","Catalogue Anne Weyburn","Jusqu'à  présent je n'ai eu aucun soucis,  commandes, retour  commandes,  service client  au téléphone,  j espère que  cela ne changera pas... continuez  et merci  à vous","il y a 9 jours","Le choix, la rapidité de livraison, la qualité, les prix, la façon de commander-essayer et retourner si besoin sans avoir à imprimer un bordereau de retour. C’est génial !","2 oct. 2023","Pourquoi j’aime ?","Les articles sont livrés rapidement.
En revanche, les points de livraison sont parfois modifiés et ne correspondent pas aux points choisis, ce qui peut être assez gênant.","1 oct. 2023","Tous les articles La Redoute satisfaisants, seulement 1 Article Market Place retourné et remboursé rapidement. La Redoute a facilité la communication avec le fournisseur.","JG","https://www.trustedshops.com/user/de_DE/6c9f03b82521e660575d41c8e71c516e","Jeanne","G.","Antony","il y a 5 jours","Qualité des articles et des échanges","Qualité des échanges quand une question se pose
Qualité des produits choisis 
Variété des marques 
Rapidité des envois
Simplicité des commandes et des retours si besoin","JN","https://www.trustedshops.com/user/de_DE/93f0c2619c661a90cd271f9310975078","Jackie","N.","Haute-Savoie","22 sept. 2023","Les produits sont de qualités.","Les produits sont de qualités et les prix sont également compétitifs. Les différents services de livraison sont très bien aussi bien pour la logistique que la livraison.","il y a 8 jours","Livraison rapide, produit conforme et correspond à nos attentes. La petite promotion qui fait plaisir afin de rendre le produit plus accessible sans y laisser un bras.","il y a 9 jours","Bonne expérience","Je fait mes achats de la redoute aux nouvelles galeries de Marseille 
Les personnels sont charmants compétents 
Les articles confirment à mes attentes tout est parfait","il y a 10 jours","Très bel imprimé et tissu de bonne tenue 
Le pantalon et la blouse peuvent se porter ensemble ou séparément, ce qui multiplie les possibilités.
Je suis très satisfaite.","PV","https://www.trustedshops.com/user/de_DE/309828746eb218d1f9483509a146f81a","Patricia","V.","Villiers sur Marne","8 oct. 2023","J'apprècie le choix que l'on trouve sur le site, la rapidité des livraisons.Le suivi et les informations très sérieux des commandes.La facilité des retours d'articles.","6 oct. 2023","Les modèles et la coupe sont bien , il y a du choix , La qualité des tissus est bonne ! 
On retrouve enfin une gamme de produits intéressantes 👍🏽 chez l’homme, merci !","28 sept. 2023","Le choix sur le site est vraiment important et c'est plaisant. Les prix sont corrects et c'est satisfaisant.
Mais la livraison va de mal en pis. C'est une catastrophe","il y a 4 jours","Les efforts sur les prix 
Il faudrait avoir la possibilité lorsqu’on a l’offre anniversaire de pouvoir l’appliquer sur n’importe quel article meme sur les prix rouges","Client de laredoute.fr","il y a 13 jours","Un ensemble très stylé","Changer d’adresse de relais colis
J’ai du y aller 3 fois avant de récupérer mon colis 
Ça nuit à votre image ce genre de problème même si vous n’etes pas responsable","","il y a 8 jours","Envoi très rapide. J'ai du renvoyer 1 article parmis les 4 de ma commande. J'ai utilisé le mode avec QR code, c est très pratique et rapide. Je suis très satisfaite","Réponse de laredoute.fr","il y a 9 jours","Bonjour, merci de nous partager votre expérience ! Nous sommes ravis lorsque nous voyons des avis positifs comme le vôtre. A bientôt ! Ilham de l'équipe Service Client.","Utile","","il y a 10 jours","Les produits achetés correspondent en tous points à mon attente.
Un seul petit souci à la livraison : retard de la poste par rapport à la date annoncée et confirmée.","https://www.trustedshops.fr/evaluation/info_XA3F5BBDE34B5AD3FB64015EB823AC7C6.html?page=1763","https://www.trustedshops.fr/evaluation/info_XA3F5BBDE34B5AD3FB64015EB823AC7C6.html?page=13","13","https://www.trustedshops.fr/evaluation/info_XA3F5BBDE34B5AD3FB64015EB823AC7C6.html?page=12","12","https://www.trustedshops.fr/evaluation/info_XA3F5BBDE34B5AD3FB64015EB823AC7C6.html?page=14","14","https://www.trustedshops.fr/evaluation/info_XA3F5BBDE34B5AD3FB64015EB823AC7C6.html?page=12","1","https://www.trustedshops.fr/evaluation/info_XA3F5BBDE34B5AD3FB64015EB823AC7C6.html","1763","...","https://www.trustedshops.fr/evaluation/info_XA3F5BBDE34B5AD3FB64015EB823AC7C6.html?page=1763","https://www.trustedshops.fr/evaluation/info_XA3F5BBDE34B5AD3FB64015EB823AC7C6.html?page=14","https://www.trustedshops.fr/evaluation/info_XA3F5BBDE34B5AD3FB64015EB823AC7C6.html","Des","mesures","https://help.etrusted.com/hc/fr/articles/4419944605341","ont été prises pour s’assurer que les avis publiés ne proviennent que de consommateurs ayant effectivement utilisé ou acheté les marchandises ou les services.","Avis importés","n’entrent pas dans la note globale. Aucune mesure de contrôle n’a été prise.","Obtenez plus d’informations sur notre « vérification avis clients ».","Haut de page","..."
"À propos de laredoute.fr","Contact","https://www.laredoute.fr/","La Redoute vous permet d’accéder à l’art de vivre à la française au meilleur prix. Nous vous faisons gagner du temps en vous proposant les dernières tendances, des marques de qualité et les meilleurs modèles. Avec de nouvelles collections chaque semaine, il y a toujours quelque chose de nouveau à découvrir. 

Grâce à notre programme de fidélité, La Redoute +, profitez d’avantages sur la livraison, les retours gratuits, ainsi que de remises et promotions supplémentaires.

La Redoute vous donne accès aux dernières tendances de la mode, du sport et vous permet d'acheter des vêtements, des chaussures, des bijoux et d'autres accessoires. Faites vos achats parmi des centaines de marques, dont Maje, Levis, Adidas, Nike et La Redoute Collections.

Vous trouverez une large gamme de produits pour la maison et la famille avec nos marques La Redoute Intérieurs & AMPM. Découvrez les derniers meubles design, ainsi que de la literie et du linge de maison élégants, des luminaires à la mode et bien plus encore. De plus, vous pouvez équiper votre maison des appareils derniers cris. 

La Redoute se veut l'interlocuteur idéal des familles : trouvez l’inspiration et découvrez nos conseils avec les guides pour choisir vos produits !

Pour améliorer nos services, nous souhaiterions connaître votre avis. Vos commentaires sont importants pour nos clients. 88% des consommateurs lisent ces avis. Grâce à vos commentaires, nos équipes améliorent nos collections et notre relation-client.","Vers le site","LA REDOUTE SAS","avisclient@redoute.fr","https://www.trustedshops.fr/evaluation/info_XA3F5BBDE34B5AD3FB64015EB823AC7C6.html?page=14#","110, rue de Blanchemaille","59100","Roubaix","France","N° au registre du commerce","RCS Lille Métropole B 477 180 186","Représentant légal","Philippe BERLAN","Catégories","https://www.trustedshops.fr/shops/bagages_sacs_maroquinerie/","Bagages, sacs & maroquinerie","https://www.trustedshops.fr/shops/chaussures/","Chaussures","https://www.trustedshops.fr/shops/habillement/","Habillement","https://www.trustedshops.fr/shops/jouets_bebes_enfants/","Jouets, bébés & enfants","https://www.trustedshops.fr/shops/meubles_decoration/","Meubles & décoration","","","","","","","","","","","","","","","","","","","","","","","","","","","","","","","","","","","","","","","","","","","","","","","","","","","","","","","","","","","","","","","","","","","","","","","","","","","","","","","","","","","","","","","","","","","","","","","","","","","","","","","","","","","","","","","","","","","","","","","","","","","","","","","","","","","",""
"l'avis le plus positif","l'avis le plus négatif","https://www.trustedshops.fr/evaluation/info_XA3F5BBDE34B5AD3FB64015EB823AC7C6.html","","","","","","","","","","Avis pour laredoute.fr","","Pour vérifier l’authenticité","","Avis validés","","","","","","","","","","","Notre mission est de favoriser la confiance digital. Plus d’info","comment fonctionnent les avis","chez Trusted Shops.","Client de laredoute.fr","Signaler un avis","26 nov. 2022","Avis validé","Satisfaite de ma commande. Par contre très en colère et me sens flouée par le cadeau à 0 €, en cliquant vous avez le droit à une trottinette, un plein d'essence et autre chose en payant 1€ On vous dirige vers Tech VIP  sur la page d'accueil un n° de passe et sur le site de trottinette mais plein d'autres produits. donc pas de commande de ma part. Un peu naïve cliente car n'ai pas lu jusqu'en bas de la page qui spécifiait qu'au bout de 48h je devenais adhérente et que je devais payer 29,20 (somme qui m'a été débitée) et ce tous les mois pour pouvoir acheter leur produit. Heureusement j'ai pu joindre TECH VIP qui a annulé mon adhésion. Votre kdo à 0€ m'a coûté 29,90 €. Je prends cela pour du vol qualifié et une anarque. je réfléchirai pour une prochaine commande à la redoute. Cordialement Danielle DEXIDIEUX","Lire la suite","Utile","1","+1","https://www.trustedshops.fr/evaluation/info_XA3F5BBDE34B5AD3FB64015EB823AC7C6.html?stars=4&stars=5","Voir les avis positifs","23 oct. 2022","Nous avons acheté une ménagère dans un magasin et fait livré en point relai (relai colis).
Le colis devait arriver 3 jours plus tard (un mardi) ce qui nous allait bien car nous en avions besoin pour recevoir nos invités (le samedi qui suit).
Au final, le colis s’est perdu en chemin. Ni la redoute ni relai colis était capable de nous dire où il se trouvait, bien que le colis était marqué comme livré au point relai. 
Nous nous sommes déplacé dans 3 points relais différents car nous avions reçu 3 notifications. 
Le colis n’était pas présent à chaque fois. 
Un interlocuteur de chez relai colis lance une enquête pour déterminer où se trouve le colis et nous assure le traiter de toute urgence. On espérait vraiment l’avoir pour samedi…
Nous l’avons reçu finalement 7 jours plus tard après le mardi supposé livré. 
0 intérêt pour nous dans ce cas là… la ménagère est encore dans son carton tellement nous avons été déçu du temps de livraison…","3","https://www.trustedshops.fr/evaluation/info_XA3F5BBDE34B5AD3FB64015EB823AC7C6.html?stars=1&stars=2&stars=3","Voir les avis négatifs","Recherche par mot-clé","Filtre","Avis","https://www.trustedshops.fr/evaluation/info_XA3F5BBDE34B5AD3FB64015EB823AC7C6.html?stars=5","(25 359)","https://www.trustedshops.fr/evaluation/info_XA3F5BBDE34B5AD3FB64015EB823AC7C6.html?stars=4","(6 033)","https://www.trustedshops.fr/evaluation/info_XA3F5BBDE34B5AD3FB64015EB823AC7C6.html?stars=3","(1 721)","https://www.trustedshops.fr/evaluation/info_XA3F5BBDE34B5AD3FB64015EB823AC7C6.html?stars=2","(1 030)","https://www.trustedshops.fr/evaluation/info_XA3F5BBDE34B5AD3FB64015EB823AC7C6.html?stars=1","(1 103)","Tri","Pertinence","https://www.trustedshops.fr/evaluation/info_XA3F5BBDE34B5AD3FB64015EB823AC7C6.html","https://www.trustedshops.fr/evaluation/info_XA3F5BBDE34B5AD3FB64015EB823AC7C6.html?sort=date","Le plus récent d'abord","29 sept. 2023","rien de plus  depuis  la commande  jusqu'a  la livraison au top  conseillére  trés  compétente et trés commerciale  continuez  salutations  sincéres  Gasnier  daniel","","25 sept. 2023","Commande petits enfants","On a oublié de compter la taie d’oreiller que je voulais également, pouvez vous la rajouter ou dois je faire une nouvelle commande….
Merci de me répondre par retour","22 sept. 2023","Commende incomplète","Pas d'écart, qualité, taille par rapport au ""catalogue""
Qualité de service ==> Date de livraison, organisation tout est OK. Pas de mauvaises surprises. Emballage ok.","il y a 2 jours","Commande arrivée très vite. Le site est vraiment bien fait avec beaucoup de choix. J'ai pu bénéficier de bonnes réductions avec La Redoute + tout  fait satisfaite.","28 sept. 2023","Bon service client et super housse la redoute","Achat rapide et sans problème, rien à  dire.
Bon choix de vêtements. Circulation aisée sur le site.
Vous pourriez améliorer vos promotions surtout en fin de saison.","il y a 11 jours","L'application est plus facile d'utilisation que le site internet.  La livraison rapide.  Et le petit plus : la réduction suite à l'installation de l'application.","29 sept. 2023","Table de qualité, mais montage difficile","Un peu déçue de ne pas avoir pû commander un ensemble de literie complet. Il manquait les taies d'oreillers dans la même gamme et coloris. Je trouve cela dommage..","29 sept. 2023","Les produits sont conformes à la description, le livreur très serviable, en revanche j'avais un message de livraison prévue samedi, alors qu' elle a eu lieu mardi","SG","https://www.trustedshops.com/user/de_DE/e9735185e67f3233a770f29b16a261ca","Sylvie","G.","Paris","24 sept. 2023","Tres satisfaite","J’ai reçu ma jupe plus vite que prévu. Par contre j’attend toujours mes bottines qui auraient dues arriver vendredi ou samedi et qui ne sont toujours pas arrivées😭","ST","https://www.trustedshops.com/user/de_DE/b29101d27155d21ae02ca6c4eff02ee8","sonia","T.","LYON","3 oct. 2023","Au top !!","J'ai apprécié le service client, rapide et efficace. 
Les housses sont extras, la couleur ressemble à celle des photo. Le rose et le bleu foncé sont très sympas.","1 oct. 2023","Rapidité et la marchandise était celle que j'avais choisie et de très bonne qualité. Je continuerai à acheter chez redoute. 
Je conseille à acheter chez Redoute.","29 sept. 2023","Erreur réparée !","La Redoute a des produits de bonne qualité avec des prix adaptés ! Je n'ai pour l'instant jamais été déçue.
Avec des délais de livraisons relativement conformes.","25 sept. 2023","Table très belle et de bonne qualité. 
Attention 5h de montage à 2 en étant bricoleurs. Je déconseille cet achat si vous voulez une table « prête à l’emploi « .","NR","https://www.trustedshops.com/user/de_DE/a8951551fce5c090dc7ced0ec299d35d","Noëlle","R.","St Flaive des Loups","il y a 6 jours","Globalement satisfaite des commandes passées à la Redoute, tant sur le choix assez large que sur les prix pratiqués ou encore le respect des dates de livraison.","6 oct. 2023","Le site de la redoute est très bien fait, et le site de suivi de transport est très bien fait également.
Beaucoup de clarté très confortable en tant que client.","29 sept. 2023","Ne changez rien à votre organisation. Rien à redire. Depuis que je suis cliente  et cela fait quelques années je n'ai jamais eu de soucis avec la redoute. Bravo","il y a 9 jours","Toute ma commande est arrivée au relais colis tres rapidement. Les produits Anne Weyburn sont d'excellentes qualités et les tailles correspondent parfaitement.","Client de laredoute.fr","8 oct. 2023","","Grand choix de produit, on trouve facilement ce qu’on cherche. Les prix sont varié. 
Juste dommage pour les frais de port parfois élevé par certaines marques.","Client de laredoute.fr","4 oct. 2023","J'ai obtenu satisfaction pour une re commande avec avantages identiques suite à une erreur de la redoute ( réception d'un article différent de celui commandé )","","","","","","3 oct. 2023","livraison rapide et soignée. bonne information préalable et horaire bien cerné. 
livraison dans la pièce de mon choix et montage par vos services 
je suis ravi","https://www.trustedshops.fr/evaluation/info_XA3F5BBDE34B5AD3FB64015EB823AC7C6.html?page=1763","https://www.trustedshops.fr/evaluation/info_XA3F5BBDE34B5AD3FB64015EB823AC7C6.html?page=14","14","https://www.trustedshops.fr/evaluation/info_XA3F5BBDE34B5AD3FB64015EB823AC7C6.html?page=13","13","https://www.trustedshops.fr/evaluation/info_XA3F5BBDE34B5AD3FB64015EB823AC7C6.html?page=15","15","https://www.trustedshops.fr/evaluation/info_XA3F5BBDE34B5AD3FB64015EB823AC7C6.html?page=13","1","https://www.trustedshops.fr/evaluation/info_XA3F5BBDE34B5AD3FB64015EB823AC7C6.html","1763","...","https://www.trustedshops.fr/evaluation/info_XA3F5BBDE34B5AD3FB64015EB823AC7C6.html?page=1763","https://www.trustedshops.fr/evaluation/info_XA3F5BBDE34B5AD3FB64015EB823AC7C6.html?page=15","https://www.trustedshops.fr/evaluation/info_XA3F5BBDE34B5AD3FB64015EB823AC7C6.html","Des","mesures","https://help.etrusted.com/hc/fr/articles/4419944605341","ont été prises pour s’assurer que les avis publiés ne proviennent que de consommateurs ayant effectivement utilisé ou acheté les marchandises ou les services.","Avis importés","n’entrent pas dans la note globale. Aucune mesure de contrôle n’a été prise.","Obtenez plus d’informations sur notre « vérification avis clients ».","Haut de page","..."
