"À propos de laredoute.fr","Contact","https://www.laredoute.fr/","La Redoute vous permet d’accéder à l’art de vivre à la française au meilleur prix. Nous vous faisons gagner du temps en vous proposant les dernières tendances, des marques de qualité et les meilleurs modèles. Avec de nouvelles collections chaque semaine, il y a toujours quelque chose de nouveau à découvrir. 

Grâce à notre programme de fidélité, La Redoute +, profitez d’avantages sur la livraison, les retours gratuits, ainsi que de remises et promotions supplémentaires.

La Redoute vous donne accès aux dernières tendances de la mode, du sport et vous permet d'acheter des vêtements, des chaussures, des bijoux et d'autres accessoires. Faites vos achats parmi des centaines de marques, dont Maje, Levis, Adidas, Nike et La Redoute Collections.

Vous trouverez une large gamme de produits pour la maison et la famille avec nos marques La Redoute Intérieurs & AMPM. Découvrez les derniers meubles design, ainsi que de la literie et du linge de maison élégants, des luminaires à la mode et bien plus encore. De plus, vous pouvez équiper votre maison des appareils derniers cris. 

La Redoute se veut l'interlocuteur idéal des familles : trouvez l’inspiration et découvrez nos conseils avec les guides pour choisir vos produits !

Pour améliorer nos services, nous souhaiterions connaître votre avis. Vos commentaires sont importants pour nos clients. 88% des consommateurs lisent ces avis. Grâce à vos commentaires, nos équipes améliorent nos collections et notre relation-client.","Vers le site","LA REDOUTE SAS","avisclient@redoute.fr","https://www.trustedshops.fr/evaluation/info_XA3F5BBDE34B5AD3FB64015EB823AC7C6.html?page=6#","110, rue de Blanchemaille","59100","Roubaix","France","N° au registre du commerce","RCS Lille Métropole B 477 180 186","Représentant légal","Philippe BERLAN","Catégories","https://www.trustedshops.fr/shops/bagages_sacs_maroquinerie/","Bagages, sacs & maroquinerie","https://www.trustedshops.fr/shops/chaussures/","Chaussures","https://www.trustedshops.fr/shops/habillement/","Habillement","https://www.trustedshops.fr/shops/jouets_bebes_enfants/","Jouets, bébés & enfants","https://www.trustedshops.fr/shops/meubles_decoration/","Meubles & décoration","","","","","","","","","","","","","","","","","","","","","","","","","","","","","","","","","","","","","","","","","","","","","","","","","","","","","","","","","","","","","","","","","","","","","","","","","","","","","","","","","","","","","","","","","","","","","","","","","","","","","","","","","","","","","","","","","","","","","","","","","","","","","","","","","","","",""
"l'avis le plus positif","l'avis le plus négatif","https://www.trustedshops.fr/evaluation/info_XA3F5BBDE34B5AD3FB64015EB823AC7C6.html","","","","","","","","","","Avis pour laredoute.fr","","Pour vérifier l’authenticité","","Avis validés","","","","","","","","","","","Notre mission est de favoriser la confiance digital. Plus d’info","comment fonctionnent les avis","chez Trusted Shops.","Client de laredoute.fr","Signaler un avis","26 nov. 2022","Avis validé","Satisfaite de ma commande. Par contre très en colère et me sens flouée par le cadeau à 0 €, en cliquant vous avez le droit à une trottinette, un plein d'essence et autre chose en payant 1€ On vous dirige vers Tech VIP  sur la page d'accueil un n° de passe et sur le site de trottinette mais plein d'autres produits. donc pas de commande de ma part. Un peu naïve cliente car n'ai pas lu jusqu'en bas de la page qui spécifiait qu'au bout de 48h je devenais adhérente et que je devais payer 29,20 (somme qui m'a été débitée) et ce tous les mois pour pouvoir acheter leur produit. Heureusement j'ai pu joindre TECH VIP qui a annulé mon adhésion. Votre kdo à 0€ m'a coûté 29,90 €. Je prends cela pour du vol qualifié et une anarque. je réfléchirai pour une prochaine commande à la redoute. Cordialement Danielle DEXIDIEUX","Lire la suite","Utile","1","+1","https://www.trustedshops.fr/evaluation/info_XA3F5BBDE34B5AD3FB64015EB823AC7C6.html?stars=4&stars=5","Voir les avis positifs","23 oct. 2022","Nous avons acheté une ménagère dans un magasin et fait livré en point relai (relai colis).
Le colis devait arriver 3 jours plus tard (un mardi) ce qui nous allait bien car nous en avions besoin pour recevoir nos invités (le samedi qui suit).
Au final, le colis s’est perdu en chemin. Ni la redoute ni relai colis était capable de nous dire où il se trouvait, bien que le colis était marqué comme livré au point relai. 
Nous nous sommes déplacé dans 3 points relais différents car nous avions reçu 3 notifications. 
Le colis n’était pas présent à chaque fois. 
Un interlocuteur de chez relai colis lance une enquête pour déterminer où se trouve le colis et nous assure le traiter de toute urgence. On espérait vraiment l’avoir pour samedi…
Nous l’avons reçu finalement 7 jours plus tard après le mardi supposé livré. 
0 intérêt pour nous dans ce cas là… la ménagère est encore dans son carton tellement nous avons été déçu du temps de livraison…","3","https://www.trustedshops.fr/evaluation/info_XA3F5BBDE34B5AD3FB64015EB823AC7C6.html?stars=1&stars=2&stars=3","Voir les avis négatifs","Recherche par mot-clé","Filtre","Avis","https://www.trustedshops.fr/evaluation/info_XA3F5BBDE34B5AD3FB64015EB823AC7C6.html?stars=5","(25 359)","https://www.trustedshops.fr/evaluation/info_XA3F5BBDE34B5AD3FB64015EB823AC7C6.html?stars=4","(6 033)","https://www.trustedshops.fr/evaluation/info_XA3F5BBDE34B5AD3FB64015EB823AC7C6.html?stars=3","(1 721)","https://www.trustedshops.fr/evaluation/info_XA3F5BBDE34B5AD3FB64015EB823AC7C6.html?stars=2","(1 030)","https://www.trustedshops.fr/evaluation/info_XA3F5BBDE34B5AD3FB64015EB823AC7C6.html?stars=1","(1 103)","Tri","Pertinence","https://www.trustedshops.fr/evaluation/info_XA3F5BBDE34B5AD3FB64015EB823AC7C6.html","https://www.trustedshops.fr/evaluation/info_XA3F5BBDE34B5AD3FB64015EB823AC7C6.html?sort=date","Le plus récent d'abord","22 sept. 2023","pas évident de trouver du 95A, et encore moins de trouver un joli et agréable soutien gorge, merci.
En lisant les commentaires sur ce choix, je signale qu'il est possible de mettre du 38/40 si l'on fait du 42, concernant le bas (c'est un grand 40)","Afficher plus","il y a 9 jours","correspond totalement à mes attentes","la livraison rapide

J'ai commandé un pantalon en taille 44 ( c'est la 4ème dans un coloris différent que j'ai commandé) mais celui ci taille beaucoup plus petit il serait judicieux de prévenir votre clientèle quand un article taille plus petit","il y a 11 jours","Simplicité","Reprise rapide, retour rapide et remboursement sans problème. Le délai est toujours correct. Par contre en ce qui concerne Les produits non pris en charge par la redoute  mais par la marque C’est pas toujours simple ainsi que Les remboursements","28 sept. 2023","je n'ai jamais été déçue ni par les produits de la Redoute ni par l'organisation, pour leur acheminement par exemple (rapidité). Idem pour l'accueil SAV, les remboursements : inutile de s'inquiéter. Donc j'achète en confiance avec la Redoute.","27 sept. 2023","jamais déçue","Emballage ok colis en parfait état à l’arrivée mais j’avais payé un chrono post pour avoir tout le le samedi. Et le colis est arrivé en 2 fois (le lendemain et le lundi suivant ) alors que c’était promis au moment de la commande le lendemain","il y a 11 jours","Il faudrait trouver un prestataire de livraison plus fiable . Colissimo La Poste, ils sont nuls, n’honorent pas leur rendez-vous, envoient des messages erronés, et, pour finir, il faut passer du temps au téléphone et courir après son colis …","il y a 11 jours","Bel article","J'ai apprécié la possibilité de commander 2 tailles différentes pour essayer. La description du produit est conforme à l'article reçu.
Livraison rapide en pickup ; par contre dommage qu'on ne puisse effectuer un retour dans ce même relais .","23 sept. 2023","Très satisfait du produit acheté (tabouret), mais pas de la livraison
(changement de relais-dépôt, plus d'une heure au téléphone pour joindre le responsable du relais).
La prochaine fois je me ferai livrer directement chez moi.
Sans rancune","RR","https://www.trustedshops.com/user/de_DE/cdf73997d069a09e0b434e00a1790145","Raymond","R.","Dunieres","il y a 6 jours","Contente de mon achat !","Très bon choix d'articles dans ce que je recherchais. Le petit bémol serait plus sur l'ergonomie du site qui n'est pas très simple au niveau des filtres proposés ou d'identifier ce qui est envoyé par la redoute ou par un autre prestataire.","VV","https://www.trustedshops.com/user/de_DE/08f01067391b9b2231cf33a92be0de96","véronique","V.","PARIS","il y a 13 jours","On peut vraiment faire confiance à la redoute mais...","facile pour commander et livraison rapide, mais un peu déçue par le produit, car indiqué pour le maillot de bain, coques amovibles alors que c'est faux, je ferai attention aux commentaires la prochaine fois car déjà indiqué par une cliente","il y a 6 jours","J’ai sauté le pas grâce à une promo très intéressante. Sinon hors de prix pour des meubles qui sont, en grande partie, en melaminé.
Très jolis chevets qui font de l’effet dans la déco.
Meubles très bien emballés, montage des pieds facile.","il y a 12 jours","Navigation facile sur le site","J'apprécie la redoute pour sa fiabilité et son excellente expérience client, on peut vraiment vous faire confiance. En revanche, j'achète moins chez vous, plus ailleurs, car il n'y a pas beaucoup de nouveautés pour les marques proposées.","il y a 13 jours","Je trouve facilement l’article que je cherche 
Et à des prix compétitifs 
Avec la redoute plus pas de frais de livraison et en plus moins 10%
Mon dernier achat drap housse satin de coton avait une forte baisse et j’en ai profité merci","MK","https://www.trustedshops.com/user/de_DE/245d38e0be3642535cf3ab6207776de7","Marie","K.","Martigues","il y a 3 jours","Je regrette l’envoi des 2 vêtements commandés par 2 livreurs différents.
Et pour les 2 jeans Levi’s de même catégorie (seule la couleur diffère), les tailles sont différentes. Je dois en retourner un : celui non envoyé par La Redoute…","il y a 8 jours","Bon produit. La photo des taies d’oreiller porte à confusion. Je pensais commander un lot de 2! L’achat supplémentaire d’une taie me coûterait trois fois le prix initialement payé  (plus de promo et frais de livraison en sus)! Dommage","7 oct. 2023","Informations claires et délai de livraison conforme à ce qui est annoncé. Amabilité au point de retrait. 
Le point de retrait est un petit loin de chez moi mais en restant raisonnable. Plus de choix en point de retrait serait un plus.","1 oct. 2023","Etagère très rapidement livrée, conforme au produit commandé, mais  certaines planches écornées aux extrémités et un choc dans l'une d'entre elle. Je précise que le colis était intact. Le produit était donc abimé avant d'être expédié.","Client de laredoute.fr","5 oct. 2023","Mode d’envoi","Avec le grand choix de La Redoute, c’est simple de trouver ce que l’on cherche.
Avec son site internet bien construit, c’est facile de chercher et commander.
Avec ses propositions de livraison, c’est rapide pour recevoir sa commande.","Client de laredoute.fr","il y a 13 jours","Merci pour la rapidité de l’envoi. J’ai reçu ma commande une journée à l’avance. Il s’agissait d’un cadeau pour ma nièce. Elle a apprécié les couleurs conformes à celles du site internet. À voir s’il sera bien chaud pour cet hiver.","Réponse de laredoute.fr","il y a 5 jours","Bonjour, merci d'avoir pris le temps de partager votre avis, et sommes désolés pour cette mauvaise expérience. Vos remarques ont été partagées, prises en compte par l'équipe et nous aident à nous améliorer ! A très vite. Ilham de l'équipe Service Client.","Utile","Client de laredoute.fr","4 oct. 2023","Très satisfaite
commande facile, livraison rapide, produit génial
A refaire, je n'envoie pas de photos mais j'ai commandé des soutiens gorge très confortables et dans lesquels je me sens très bien (Glamorise 120F) car sans baleines","https://www.trustedshops.fr/evaluation/info_XA3F5BBDE34B5AD3FB64015EB823AC7C6.html?page=1763","https://www.trustedshops.fr/evaluation/info_XA3F5BBDE34B5AD3FB64015EB823AC7C6.html?page=6","6","https://www.trustedshops.fr/evaluation/info_XA3F5BBDE34B5AD3FB64015EB823AC7C6.html?page=5","5","https://www.trustedshops.fr/evaluation/info_XA3F5BBDE34B5AD3FB64015EB823AC7C6.html?page=7","7","https://www.trustedshops.fr/evaluation/info_XA3F5BBDE34B5AD3FB64015EB823AC7C6.html?page=5","1","https://www.trustedshops.fr/evaluation/info_XA3F5BBDE34B5AD3FB64015EB823AC7C6.html","1763","...","https://www.trustedshops.fr/evaluation/info_XA3F5BBDE34B5AD3FB64015EB823AC7C6.html?page=1763","https://www.trustedshops.fr/evaluation/info_XA3F5BBDE34B5AD3FB64015EB823AC7C6.html?page=7","https://www.trustedshops.fr/evaluation/info_XA3F5BBDE34B5AD3FB64015EB823AC7C6.html","Des","mesures","https://help.etrusted.com/hc/fr/articles/4419944605341","ont été prises pour s’assurer que les avis publiés ne proviennent que de consommateurs ayant effectivement utilisé ou acheté les marchandises ou les services.","Avis importés","n’entrent pas dans la note globale. Aucune mesure de contrôle n’a été prise.","Obtenez plus d’informations sur notre « vérification avis clients ».","Haut de page","..."
"À propos de laredoute.fr","Contact","https://www.laredoute.fr/","La Redoute vous permet d’accéder à l’art de vivre à la française au meilleur prix. Nous vous faisons gagner du temps en vous proposant les dernières tendances, des marques de qualité et les meilleurs modèles. Avec de nouvelles collections chaque semaine, il y a toujours quelque chose de nouveau à découvrir. 

Grâce à notre programme de fidélité, La Redoute +, profitez d’avantages sur la livraison, les retours gratuits, ainsi que de remises et promotions supplémentaires.

La Redoute vous donne accès aux dernières tendances de la mode, du sport et vous permet d'acheter des vêtements, des chaussures, des bijoux et d'autres accessoires. Faites vos achats parmi des centaines de marques, dont Maje, Levis, Adidas, Nike et La Redoute Collections.

Vous trouverez une large gamme de produits pour la maison et la famille avec nos marques La Redoute Intérieurs & AMPM. Découvrez les derniers meubles design, ainsi que de la literie et du linge de maison élégants, des luminaires à la mode et bien plus encore. De plus, vous pouvez équiper votre maison des appareils derniers cris. 

La Redoute se veut l'interlocuteur idéal des familles : trouvez l’inspiration et découvrez nos conseils avec les guides pour choisir vos produits !

Pour améliorer nos services, nous souhaiterions connaître votre avis. Vos commentaires sont importants pour nos clients. 88% des consommateurs lisent ces avis. Grâce à vos commentaires, nos équipes améliorent nos collections et notre relation-client.","Vers le site","LA REDOUTE SAS","avisclient@redoute.fr","https://www.trustedshops.fr/evaluation/info_XA3F5BBDE34B5AD3FB64015EB823AC7C6.html?page=7#","110, rue de Blanchemaille","59100","Roubaix","France","N° au registre du commerce","RCS Lille Métropole B 477 180 186","Représentant légal","Philippe BERLAN","Catégories","https://www.trustedshops.fr/shops/bagages_sacs_maroquinerie/","Bagages, sacs & maroquinerie","https://www.trustedshops.fr/shops/chaussures/","Chaussures","https://www.trustedshops.fr/shops/habillement/","Habillement","https://www.trustedshops.fr/shops/jouets_bebes_enfants/","Jouets, bébés & enfants","https://www.trustedshops.fr/shops/meubles_decoration/","Meubles & décoration","","","","","","","","","","","","","","","","","","","","","","","","","","","","","","","","","","","","","","","","","","","","","","","","","","","","","","","","","","","","","","","","","","","","","","","","","","","","","","","","","","","","","","","","","","","","","","","","","","","","","","","","","","","","","","","","","","","","","","","","","","","","","","","","","","","",""
